AutoTVM/gemm_vectorize.log
{"input": ["cuda -keys=cuda,gpu -arch=sm_86 -max_num_threads=1024 -thread_warp_size=32", "gemm_vectorize/gemm_vectorize", [16384, 16384, 16384], {}], "config": {"index": 63176, "code_hash": null, "entity": [["tile_partsx", "ot", 1], ["tile_partsy", "ot", 4], ["tile_num_threadx", "ot", 16], ["tile_num_thready", "ot", 32], ["tile_num_blockx", "ot", 32], ["tile_num_blocky", "ot", 128]]}, "result": [[3.3195463865000003, 3.4163061522500002], 0, 56.72350835800171, 1723197705.5986588], "version": 0.2, "tvm_version": "0.16.0"}
{"input": ["cuda -keys=cuda,gpu -arch=sm_86 -max_num_threads=1024 -thread_warp_size=32", "gemm_vectorize/gemm_vectorize", [16384, 16384, 16384], {}], "config": {"index": 56677, "code_hash": null, "entity": [["tile_partsx", "ot", 2], ["tile_partsy", "ot", 2], ["tile_num_threadx", "ot", 64], ["tile_num_thready", "ot", 4], ["tile_num_blockx", "ot", 128], ["tile_num_blocky", "ot", 64]]}, "result": [[1.4241607665, 1.43088513175], 0, 38.52304291725159, 1723198055.743811], "version": 0.2, "tvm_version": "0.16.0"}
{"input": ["cuda -keys=cuda,gpu -arch=sm_86 -max_num_threads=1024 -thread_warp_size=32", "gemm_vectorize/gemm_vectorize", [16384, 16384, 16384], {}], "config": {"index": 57011, "code_hash": null, "entity": [["tile_partsx", "ot", 8], ["tile_partsy", "ot", 1], ["tile_num_threadx", "ot", 8], ["tile_num_thready", "ot", 32], ["tile_num_blockx", "ot", 128], ["tile_num_blocky", "ot", 64]]}, "result": [[1.69337756325, 1.7027711179999998], 0, 41.987637519836426, 1723198731.9248922], "version": 0.2, "tvm_version": "0.16.0"}
{"input": ["cuda -keys=cuda,gpu -arch=sm_86 -max_num_threads=1024 -thread_warp_size=32", "gemm_vectorize/gemm_vectorize", [16384, 16384, 16384], {}], "config": {"index": 52622, "code_hash": null, "entity": [["tile_partsx", "ot", 4], ["tile_partsy", "ot", 8], ["tile_num_threadx", "ot", 1], ["tile_num_thready", "ot", 8], ["tile_num_blockx", "ot", 8], ["tile_num_blocky", "ot", 64]]}, "result": [[8.111104492, 8.508845703], 0, 107.4608211517334, 1723204961.7778933], "version": 0.2, "tvm_version": "0.16.0"}
{"input": ["cuda -keys=cuda,gpu -arch=sm_86 -max_num_threads=1024 -thread_warp_size=32", "gemm_vectorize/gemm_vectorize", [16384, 16384, 16384], {}], "config": {"index": 55998, "code_hash": null, "entity": [["tile_partsx", "ot", 4], ["tile_partsy", "ot", 8], ["tile_num_threadx", "ot", 8], ["tile_num_thready", "ot", 32], ["tile_num_blockx", "ot", 64], ["tile_num_blocky", "ot", 64]]}, "result": [[5.0935390625, 5.14727490225], 0, 73.59540820121765, 1723208861.4861193], "version": 0.2, "tvm_version": "0.16.0"}
{"input": ["cuda -keys=cuda,gpu -arch=sm_86 -max_num_threads=1024 -thread_warp_size=32", "gemm_vectorize/gemm_vectorize", [16384, 16384, 16384], {}], "config": {"index": 47425, "code_hash": null, "entity": [["tile_partsx", "ot", 2], ["tile_partsy", "ot", 1], ["tile_num_threadx", "ot", 16], ["tile_num_thready", "ot", 4], ["tile_num_blockx", "ot", 64], ["tile_num_blocky", "ot", 32]]}, "result": [[1.8656202392499999, 1.86610046375], 0, 43.89743423461914, 1723209434.4510212], "version": 0.2, "tvm_version": "0.16.0"}
{"input": ["cuda -keys=cuda,gpu -arch=sm_86 -max_num_threads=1024 -thread_warp_size=32", "gemm_vectorize/gemm_vectorize", [16384, 16384, 16384], {}], "config": {"index": 55088, "code_hash": null, "entity": [["tile_partsx", "ot", 1], ["tile_partsy", "ot", 1], ["tile_num_threadx", "ot", 8], ["tile_num_thready", "ot", 64], ["tile_num_blockx", "ot", 32], ["tile_num_blocky", "ot", 64]]}, "result": [[3.81869140625, 4.164862304500001], 0, 62.30552697181702, 1723210223.7224746], "version": 0.2, "tvm_version": "0.16.0"}
{"input": ["cuda -keys=cuda,gpu -arch=sm_86 -max_num_threads=1024 -thread_warp_size=32", "gemm_vectorize/gemm_vectorize", [16384, 16384, 16384], {}], "config": {"index": 37281, "code_hash": null, "entity": [["tile_partsx", "ot", 2], ["tile_partsy", "ot", 1], ["tile_num_threadx", "ot", 4], ["tile_num_thready", "ot", 8], ["tile_num_blockx", "ot", 16], ["tile_num_blocky", "ot", 16]]}, "result": [[4.504126464750001, 4.53963867175], 0, 69.04551196098328, 1723210649.0528517], "version": 0.2, "tvm_version": "0.16.0"}
{"input": ["cuda -keys=cuda,gpu -arch=sm_86 -max_num_threads=1024 -thread_warp_size=32", "gemm_vectorize/gemm_vectorize", [16384, 16384, 16384], {}], "config": {"index": 40245, "code_hash": null, "entity": [["tile_partsx", "ot", 2], ["tile_partsy", "ot", 2], ["tile_num_threadx", "ot", 8], ["tile_num_thready", "ot", 4], ["tile_num_blockx", "ot", 128], ["tile_num_blocky", "ot", 16]]}, "result": [[3.8271145017499997, 3.7964272460000004], 0, 61.45157599449158, 1723210707.1272843], "version": 0.2, "tvm_version": "0.16.0"}
{"input": ["cuda -keys=cuda,gpu -arch=sm_86 -max_num_threads=1024 -thread_warp_size=32", "gemm_vectorize/gemm_vectorize", [16384, 16384, 16384], {}], "config": {"index": 39262, "code_hash": null, "entity": [["tile_partsx", "ot", 4], ["tile_partsy", "ot", 8], ["tile_num_threadx", "ot", 32], ["tile_num_thready", "ot", 4], ["tile_num_blockx", "ot", 64], ["tile_num_blocky", "ot", 16]]}, "result": [[9.09832519525, 9.35130078125], 0, 110.22988939285278, 1723211116.103497], "version": 0.2, "tvm_version": "0.16.0"}
{"input": ["cuda -keys=cuda,gpu -arch=sm_86 -max_num_threads=1024 -thread_warp_size=32", "gemm_vectorize/gemm_vectorize", [16384, 16384, 16384], {}], "config": {"index": 87051, "code_hash": null, "entity": [["tile_partsx", "ot", 2], ["tile_partsy", "ot", 1], ["tile_num_threadx", "ot", 4], ["tile_num_thready", "ot", 8], ["tile_num_blockx", "ot", 64], ["tile_num_blocky", "ot", 64]]}, "result": [[1.37717041, 1.3812746580000002], 0, 40.099897146224976, 1723272015.9234722], "version": 0.2, "tvm_version": "0.16.0"}
{"input": ["cuda -keys=cuda,gpu -arch=sm_86 -max_num_threads=1024 -thread_warp_size=32", "gemm_vectorize/gemm_vectorize", [16384, 16384, 16384], {}], "config": {"index": 98407, "code_hash": null, "entity": [["tile_partsx", "ot", 4], ["tile_partsy", "ot", 2], ["tile_num_threadx", "ot", 1], ["tile_num_thready", "ot", 16], ["tile_num_blockx", "ot", 32], ["tile_num_blocky", "ot", 128]]}, "result": [[8.595870117, 8.8064609375], 0, 104.3698148727417, 1723273862.606228], "version": 0.2, "tvm_version": "0.16.0"}
{"input": ["cuda -keys=cuda,gpu -arch=sm_86 -max_num_threads=1024 -thread_warp_size=32", "gemm_vectorize/gemm_vectorize", [16384, 16384, 16384], {}], "config": {"index": 70491, "code_hash": null, "entity": [["tile_partsx", "ot", 2], ["tile_partsy", "ot", 8], ["tile_num_threadx", "ot", 8], ["tile_num_thready", "ot", 1], ["tile_num_blockx", "ot", 16], ["tile_num_blocky", "ot", 32]]}, "result": [[5.18575927725, 5.2164985349999995], 0, 73.56007552146912, 1723274913.9678326], "version": 0.2, "tvm_version": "0.16.0"}
{"input": ["cuda -keys=cuda,gpu -arch=sm_86 -max_num_threads=1024 -thread_warp_size=32", "gemm_vectorize/gemm_vectorize", [16384, 16384, 16384], {}], "config": {"index": 98680, "code_hash": null, "entity": [["tile_partsx", "ot", 1], ["tile_partsy", "ot", 2], ["tile_num_threadx", "ot", 8], ["tile_num_thready", "ot", 32], ["tile_num_blockx", "ot", 32], ["tile_num_blocky", "ot", 128]]}, "result": [[1.55797790525, 1.5668121337499998], 0, 41.05732798576355, 1723275129.160638], "version": 0.2, "tvm_version": "0.16.0"}
{"input": ["cuda -keys=cuda,gpu -arch=sm_86 -max_num_threads=1024 -thread_warp_size=32", "gemm_vectorize/gemm_vectorize", [16384, 16384, 16384], {}], "config": {"index": 59333, "code_hash": null, "entity": [["tile_partsx", "ot", 8], ["tile_partsy", "ot", 2], ["tile_num_threadx", "ot", 32], ["tile_num_thready", "ot", 1], ["tile_num_blockx", "ot", 32], ["tile_num_blocky", "ot", 16]]}, "result": [[10.34784179675, 10.6418222655], 0, 121.47101259231567, 1723276413.4547753], "version": 0.2, "tvm_version": "0.16.0"}
{"input": ["cuda -keys=cuda,gpu -arch=sm_86 -max_num_threads=1024 -thread_warp_size=32", "gemm_vectorize/gemm_vectorize", [16384, 16384, 16384], {}], "config": {"index": 89281, "code_hash": null, "entity": [["tile_partsx", "ot", 2], ["tile_partsy", "ot", 2], ["tile_num_threadx", "ot", 8], ["tile_num_thready", "ot", 64], ["tile_num_blockx", "ot", 128], ["tile_num_blocky", "ot", 64]]}, "result": [[5.5911767577500004, 5.6465170897500006], 0, 77.36369156837463, 1723276730.4949243], "version": 0.2, "tvm_version": "0.16.0"}
{"input": ["cuda -keys=cuda,gpu -arch=sm_86 -max_num_threads=1024 -thread_warp_size=32", "gemm_vectorize/gemm_vectorize", [16384, 16384, 16384], {}], "config": {"index": 100335, "code_hash": null, "entity": [["tile_partsx", "ot", 1], ["tile_partsy", "ot", 4], ["tile_num_threadx", "ot", 32], ["tile_num_thready", "ot", 32], ["tile_num_blockx", "ot", 64], ["tile_num_blocky", "ot", 128]]}, "result": [[3.5670861814999997, 3.5787788085], 0, 58.5278103351593, 1723281086.74794], "version": 0.2, "tvm_version": "0.16.0"}
{"input": ["cuda -keys=cuda,gpu -arch=sm_86 -max_num_threads=1024 -thread_warp_size=32", "gemm_vectorize/gemm_vectorize", [16384, 16384, 16384], {}], "config": {"index": 87115, "code_hash": null, "entity": [["tile_partsx", "ot", 1], ["tile_partsy", "ot", 8], ["tile_num_threadx", "ot", 16], ["tile_num_thready", "ot", 8], ["tile_num_blockx", "ot", 64], ["tile_num_blocky", "ot", 64]]}, "result": [[1.69584790025, 1.70473571775], 0, 45.027507066726685, 1723292685.3900578], "version": 0.2, "tvm_version": "0.16.0"}
{"input": ["cuda -keys=cuda,gpu -arch=sm_86 -max_num_threads=1024 -thread_warp_size=32", "gemm_vectorize/gemm_vectorize", [16384, 16384, 16384], {}], "config": {"index": 88716, "code_hash": null, "entity": [["tile_partsx", "ot", 2], ["tile_partsy", "ot", 8], ["tile_num_threadx", "ot", 16], ["tile_num_thready", "ot", 8], ["tile_num_blockx", "ot", 128], ["tile_num_blocky", "ot", 64]]}, "result": [[1.2683415525000001, 1.2946135252500002], 0, 39.244606018066406, 1723428733.5980496], "version": 0.2, "tvm_version": "0.16.0"}
{"input": ["cuda -keys=cuda,gpu -arch=sm_86 -max_num_threads=1024 -thread_warp_size=32", "gemm_vectorize/gemm_vectorize", [16384, 16384, 16384], {}], "config": {"index": 73785, "code_hash": null, "entity": [["tile_partsx", "ot", 1], ["tile_partsy", "ot", 4], ["tile_num_threadx", "ot", 128], ["tile_num_thready", "ot", 1], ["tile_num_blockx", "ot", 64], ["tile_num_blocky", "ot", 32]]}, "result": [[3.9563256835000002, 3.925979248], 0, 62.818230867385864, 1723429124.1977055], "version": 0.2, "tvm_version": "0.16.0"}
{"input": ["cuda -keys=cuda,gpu -arch=sm_86 -max_num_threads=1024 -thread_warp_size=32", "gemm_vectorize", [16384, 16384, 16384], {}], "config": {"index": 99890, "code_hash": null, "entity": [["tile_partsx", "ot", 1], ["tile_partsy", "ot", 8], ["tile_num_threadx", "ot", 8], ["tile_num_thready", "ot", 8], ["tile_num_blockx", "ot", 64], ["tile_num_blocky", "ot", 128]]}, "result": [[1.081305908, 1.0866359862500001], 0, 37.4031286239624, 1723435310.7480688], "version": 0.2, "tvm_version": "0.16.0"}
